{
  "id": "SPIKE-0001",
  "title": "Research timeline visualization libraries and activity aggregation patterns",
  "description": "Investigate technical approaches for building a scalable contact activity timeline that can handle high-volume activity data (emails, calls, meetings, notes) and provide real-time updates. Need to evaluate visualization libraries, data aggregation strategies, and caching approaches.",
  "featureId": "FEAT-0004",
  "status": "planned",
  "questions": [
    {
      "question": "Which timeline visualization library provides the best performance and UX for our requirements (React-based, virtualization support, custom event rendering)?",
      "answered": false,
      "answer": ""
    },
    {
      "question": "What is the optimal data aggregation strategy for contacts with 1000+ activities (pagination, infinite scroll, or time-based bucketing)?",
      "answered": false,
      "answer": ""
    },
    {
      "question": "How should we implement real-time timeline updates when other users add activities (WebSocket, polling, or event-driven architecture)?",
      "answered": false,
      "answer": ""
    },
    {
      "question": "What caching strategy will provide the best balance between data freshness and query performance?",
      "answered": false,
      "answer": ""
    }
  ],
  "timebox": {
    "duration": 3,
    "unit": "days",
    "startDate": "2025-02-20T09:00:00Z",
    "endDate": "2025-02-23T17:00:00Z"
  },
  "objectives": [
    "Evaluate at least 3 timeline visualization libraries with POC implementations",
    "Test data loading performance with datasets of 100, 1000, and 10000 activities",
    "Define technical architecture for activity aggregation and caching",
    "Document recommended approach with trade-offs analysis",
    "Identify potential risks and mitigation strategies"
  ],
  "findings": {
    "summary": "",
    "recommendations": [],
    "risks": [],
    "nextSteps": []
  },
  "assignee": "david.park",
  "artifacts": [],
  "metadata": {
    "createdAt": "2025-02-14T10:00:00Z",
    "updatedAt": "2025-02-14T10:00:00Z",
    "createdBy": "david.park",
    "tags": ["contacts", "timeline", "research", "technical-spike"]
  }
}
